<?xml version="1.0" encoding='ISO-8859-1'?>
<!--
The contents of this file are subject to the terms of the Common Development
and Distribution License (the License). You may not use this file except in
compliance with the License.

You can obtain a copy of the License at http://www.netbeans.org/cddl.html
or http://www.netbeans.org/cddl.txt.

When distributing Covered Code, include this CDDL Header Notice in each file
and include the License file at http://www.netbeans.org/cddl.txt.
If applicable, add the following below the CDDL Header, with the fields
enclosed by brackets [] replaced by your own identifying information:
"Portions Copyrighted [year] [name of copyright owner]"

The Original Software is NetBeans. The Initial Developer of the Original
Software is Sun Microsystems, Inc. Portions Copyright 1997-2006 Sun
Microsystems, Inc. All Rights Reserved.
-->


<!DOCTYPE orb-settings PUBLIC "-//Forte for Java//DTD ORBSettings 1.0//EN" "ORBSettings.dtd"[
<!ENTITY corba20-generic-impl SYSTEM "nbres:/org/netbeans/modules/corba/resources/impls/corba20-generic-impl.ent">
]>
<orb-settings name='J2EE ORB' tag='j2ee' supported='true'>

  &corba20-generic-impl;

  <idl-compiler-settings>
    <tie-param value='--tie'/>
    <dir-param value='--directory'/>
    <package-param value='--package'/>
    <compiler value='java -classpath {classpath}{:}{library} org.netbeans.modules.corba.idl.compiler.j2ee.Compiler {cpp_params} {params} {dir_param} {package_root} {package_param} {package} {files}'/>
    <package-delimiter value='.'/>
    <error-expression value='^([^ \n]+) \(line ([0-9]+)\): (.*)'/>
    <file-position value='1'/>
    <line-position value='2'/>
    <column-position value='-1'/>
    <message-position value='3'/>
      
  </idl-compiler-settings>

</orb-settings>
